"paragraph","text"
48,"Now I’m lucky in a number of respects. I’m lucky in the sense that I’m pretty proficient and experienced in navigating around the Internet and I know how to find good information. I’m lucky that I have fast broadband access at home and I’m lucky that I’ve spent 31 years working in the National Health Service either as a clinician or as a manager. So that also helped to guide me fairly rapidly towards the good stuff. But had I had, if I hadn’t had those advantages I think I would have found it really quite difficult to arrive at enough information to make a truly informed judgement and decision about the course of treatment that suited me best."
49,"I hear fairly encouraging things in the NHS about the imminent advent of information prescriptions for patients and I know that there are a number of resources out there not least NHS Direct and particularly NHS Direct Online which is a very useful resource amongst many other useful resources. But I would hope that if in 20 years time either of my sons were to have the same condition by that stage we would be in an NHS that would equip them spontaneously with a much richer, more detailed, more specific, more evidence-based cross section of literature. And then in addition to the literature that is spontaneously provided I would hope that they would then be signposted towards other specific sources of information that could be relied upon rather than being left having to form their own judgments about what’s the good stuff and what’s not the good stuff."
50,"In this summary men we interviewed describe their experiences of biopsies. If the initial tests (rectal examination, PSA or ultrasound) show the possibility of cancer,..."
51,"Some prostate cancers are very slow growing and never cause the man any problem. This is particularly true with older men, many of whom will..."
52,"PayPal.Donation.Button({ env:'production', hosted_button_id:'HL22F9SUE2RN8', image: { src:'/wp-content/uploads/2023/11/Donate-button-1.png', alt:'Donate with PayPal button', title:'PayPal - The safer, easier way to pay online!', } }).render('#donate-button');"
